Code,Name,Exchange,Type,Source
#008328,诺安新兴产业混合,CHINA,Mutual Fund,ak
#000209,信诚新兴产业混合,CHINA,Mutual Fund,ak
#000828,泰达转型机遇,CHINA,Mutual Fund,ak
#400015,东方新能源汽车混合,CHINA,Mutual Fund,ak
#002083,新华鑫动力灵活配置混合A,CHINA,Mutual Fund,ak
#002084,新华鑫动力灵活配置混合C,CHINA,Mutual Fund,ak
#001790,国泰智能汽车股票A,CHINA,Mutual Fund,ak
#011323,国泰智能汽车股票C,CHINA,Mutual Fund,ak
#162201,泰达宏利成长混合,CHINA,Mutual Fund,ak
#010135,泰达高研发创新6个月混合A,CHINA,Mutual Fund,ak
#010136,泰达高研发创新6个月混合C,CHINA,Mutual Fund,ak
#002919,东吴智慧医疗量化混合,CHINA,Mutual Fund,ak
#004745,长盛创新驱动灵活配置混合,CHINA,Mutual Fund,ak
#000073,上投摩根成长动力混合,CHINA,Mutual Fund,ak
#519095,新华行业周期轮换混合,CHINA,Mutual Fund,ak
#003834,华夏能源革新股票,CHINA,Mutual Fund,ak
#501057,汇添富中证新能源汽车A,CHINA,Mutual Fund,ak
#501058,汇添富中证新能源汽车C,CHINA,Mutual Fund,ak
#008445,融通产业趋势先锋股票,CHINA,Mutual Fund,ak
#009189,华宝成长策略混合,CHINA,Mutual Fund,ak
#002708,大摩健康产业混合,CHINA,Mutual Fund,ak
#010654,天弘医药创新A,CHINA,Mutual Fund,ak
#010655,天弘医药创新C,CHINA,Mutual Fund,ak
#007689,国投瑞银新能源混合A,CHINA,Mutual Fund,ak
#007690,国投瑞银新能源混合C,CHINA,Mutual Fund,ak
#377020,上投摩根内需动力混合,CHINA,Mutual Fund,ak
#240020,华宝医药生物混合,CHINA,Mutual Fund,ak
#580006,东吴新经济混合,CHINA,Mutual Fund,ak
#005939,工银新能源汽车混合A,CHINA,Mutual Fund,ak
#005940,工银新能源汽车混合C,CHINA,Mutual Fund,ak
#164905,交银新能源指数(LOF),CHINA,Mutual Fund,ak
#004573,新华鑫泰灵活配置混合,CHINA,Mutual Fund,ak
#001156,申万菱信新能源汽车混合,CHINA,Mutual Fund,ak
#005368,富国清洁能源产业混合A,CHINA,Mutual Fund,ak
#011127,富国清洁能源产业混合C,CHINA,Mutual Fund,ak
#000696,汇添富环保行业股票,CHINA,Mutual Fund,ak
#001245,工银生态环境股票,CHINA,Mutual Fund,ak
#005927,创金合信新能源汽车股票A,CHINA,Mutual Fund,ak
#005928,创金合信新能源汽车股票C,CHINA,Mutual Fund,ak
#006736,国投瑞银先进制造混合,CHINA,Mutual Fund,ak
#002272,新华科技创新主题灵活配置混合,CHINA,Mutual Fund,ak
#519778,交银经济新动力混合,CHINA,Mutual Fund,ak
#007261,融通消费升级混合,CHINA,Mutual Fund,ak
#007527,融通量化多策略混合A,CHINA,Mutual Fund,ak
#007528,融通量化多策略混合C,CHINA,Mutual Fund,ak
#001852,融通中国风1号灵活配置混合A/B,CHINA,Mutual Fund,ak
#162202,泰达宏利周期混合,CHINA,Mutual Fund,ak
#005037,银华新能源新材料A,CHINA,Mutual Fund,ak
#005038,银华新能源新材料C,CHINA,Mutual Fund,ak
#009273,融通中国风1号灵活配置混合C,CHINA,Mutual Fund,ak
#005119,银华智荟内在价值灵活配置,CHINA,Mutual Fund,ak
#009891,融通产业趋势臻选股票,CHINA,Mutual Fund,ak
#003940,银华盛世精选灵活配置混合发起式,CHINA,Mutual Fund,ak
#011146,创金气候变化责任投资股票A,CHINA,Mutual Fund,ak
#011147,创金气候变化责任投资股票C,CHINA,Mutual Fund,ak
#003853,金鹰信息产业股票A,CHINA,Mutual Fund,ak
#005885,金鹰信息产业股票C,CHINA,Mutual Fund,ak
#001704,国投瑞银进宝灵活配置混合,CHINA,Mutual Fund,ak
#009640,中银证券优选行业龙头混合A,CHINA,Mutual Fund,ak
#009641,中银证券优选行业龙头混合C,CHINA,Mutual Fund,ak
#006250,上投摩根动力精选,CHINA,Mutual Fund,ak
#010090,中信建投医药健康A,CHINA,Mutual Fund,ak
#010091,中信建投医药健康C,CHINA,Mutual Fund,ak
#000496,长安产业精选混合A,CHINA,Mutual Fund,ak
#002071,长安产业精选混合C,CHINA,Mutual Fund,ak
#008955,交银创新领航混合,CHINA,Mutual Fund,ak
#519727,交银成长30混合,CHINA,Mutual Fund,ak
#005894,华夏优势精选股票,CHINA,Mutual Fund,ak
#005009,申万菱信行业轮动股票,CHINA,Mutual Fund,ak
#370024,上投摩根核心优选混合,CHINA,Mutual Fund,ak
#004890,中邮健康文娱混合,CHINA,Mutual Fund,ak
#001000,中欧明睿新起点混合,CHINA,Mutual Fund,ak
#340007,兴全社会责任混合,CHINA,Mutual Fund,ak
#001574,中海混改红利混合,CHINA,Mutual Fund,ak
#010805,东财新能源车A,CHINA,Mutual Fund,ak
#010806,东财新能源车C,CHINA,Mutual Fund,ak
#377240,上投摩根新兴动力混合A,CHINA,Mutual Fund,ak
#008381,前海开源新兴产业混合,CHINA,Mutual Fund,ak
#000913,农银医疗保健股票,CHINA,Mutual Fund,ak
#005076,创金合信优选回报灵活配置混合,CHINA,Mutual Fund,ak
#540008,汇丰晋信低碳先锋股票,CHINA,Mutual Fund,ak
#005543,银华心诚灵活配置混合,CHINA,Mutual Fund,ak
#004925,长信低碳环保行业量化股票,CHINA,Mutual Fund,ak
#162208,泰达宏利首选企业股票,CHINA,Mutual Fund,ak
#690011,民生加银积极成长混合发起式,CHINA,Mutual Fund,ak
#006154,华安制造先锋混合,CHINA,Mutual Fund,ak
#000867,华宝品质生活股票,CHINA,Mutual Fund,ak
#160225,国泰国证新能源汽车指数,CHINA,Mutual Fund,ak
#377530,上投摩根行业轮动混合A,CHINA,Mutual Fund,ak
#010345,华泰柏瑞成长智选混合A,CHINA,Mutual Fund,ak
#161028,富国中证新能源汽车指数(LOF),CHINA,Mutual Fund,ak
#010346,华泰柏瑞成长智选混合C,CHINA,Mutual Fund,ak
#005669,前海开源公用事业股票,CHINA,Mutual Fund,ak
#009852,银华品质消费股票,CHINA,Mutual Fund,ak
#007306,华泰柏瑞基本面智选A,CHINA,Mutual Fund,ak
#007307,华泰柏瑞基本面智选C,CHINA,Mutual Fund,ak
#009067,国泰中证新能源汽车ETF联接A,CHINA,Mutual Fund,ak
#009068,国泰中证新能源汽车ETF联接C,CHINA,Mutual Fund,ak
#008526,华泰柏瑞行业精选A,CHINA,Mutual Fund,ak
#008527,华泰柏瑞行业精选C,CHINA,Mutual Fund,ak
#001267,泰达宏利蓝筹混合,CHINA,Mutual Fund,ak
#005968,创金合信工业周期股票A,CHINA,Mutual Fund,ak
#005969,创金合信工业周期股票C,CHINA,Mutual Fund,ak
#001225,中邮趋势精选灵活配置混合,CHINA,Mutual Fund,ak
#001125,博时互联网主题灵活配置混合,CHINA,Mutual Fund,ak
#010460,兴业研究精选混合,CHINA,Mutual Fund,ak
#460001,华泰柏瑞盛世中国混合,CHINA,Mutual Fund,ak
#379010,上投摩根中小盘混合,CHINA,Mutual Fund,ak
#000173,汇添富美丽30混合,CHINA,Mutual Fund,ak
#375010,上投摩根中国优势混合,CHINA,Mutual Fund,ak
#005844,东方人工智能主题混合,CHINA,Mutual Fund,ak
#008997,同泰竞争优势混合A,CHINA,Mutual Fund,ak
#008998,同泰竞争优势混合C,CHINA,Mutual Fund,ak
#005544,银华瑞和灵活配置混合,CHINA,Mutual Fund,ak
#001398,华泰柏瑞健康生活混合,CHINA,Mutual Fund,ak
#011082,国投瑞银医疗保健混合C,CHINA,Mutual Fund,ak
#000523,国投瑞银医疗保健混合A,CHINA,Mutual Fund,ak
#001726,汇添富新兴消费股票,CHINA,Mutual Fund,ak
#006266,永赢智能领先混合A,CHINA,Mutual Fund,ak
#006269,永赢智能领先混合C,CHINA,Mutual Fund,ak
#009556,兴全合丰三年持有混合,CHINA,Mutual Fund,ak
#460007,华泰柏瑞行业领先混合,CHINA,Mutual Fund,ak
#007277,恒生前海消费升级混合,CHINA,Mutual Fund,ak
#001723,华商新动力混合,CHINA,Mutual Fund,ak
#162204,泰达宏利行业混合,CHINA,Mutual Fund,ak
#005708,国联安远见成长混合,CHINA,Mutual Fund,ak
#000689,前海开源新经济混合,CHINA,Mutual Fund,ak
#008293,农银汇理创新医疗混合,CHINA,Mutual Fund,ak
#519150,新华优选消费混合,CHINA,Mutual Fund,ak
#519655,银河服务混合,CHINA,Mutual Fund,ak
#006240,中融医疗健康混合A,CHINA,Mutual Fund,ak
#519670,银河行业混合,CHINA,Mutual Fund,ak
#010685,工银前沿医疗股票C,CHINA,Mutual Fund,ak
#006228,中欧医疗创新股票A,CHINA,Mutual Fund,ak
#003835,鹏华沪深港新兴成长混合,CHINA,Mutual Fund,ak
#006241,中融医疗健康混合C,CHINA,Mutual Fund,ak
#519008,汇添富优势精选混合,CHINA,Mutual Fund,ak
#006229,中欧医疗创新股票C,CHINA,Mutual Fund,ak
#000831,工银医疗保健股票,CHINA,Mutual Fund,ak
#160805,长盛同智优势混合(LOF),CHINA,Mutual Fund,ak
#001717,工银前沿医疗股票A,CHINA,Mutual Fund,ak
#001042,华夏领先股票,CHINA,Mutual Fund,ak
#004905,华泰柏瑞生物医药混合A,CHINA,Mutual Fund,ak
#010031,华泰柏瑞生物医药混合C,CHINA,Mutual Fund,ak
#004041,金鹰医疗健康产业C,CHINA,Mutual Fund,ak
#004040,金鹰医疗健康产业A,CHINA,Mutual Fund,ak
#001298,金鹰民族新兴混合,CHINA,Mutual Fund,ak
#163001,长信医疗保健混合(LOF),CHINA,Mutual Fund,ak
#501078,广发科创主题3年封闭混合,CHINA,Mutual Fund,ak
#005583,易方达港股通红利混合,CHINA,Mutual Fund,ak
#008843,同泰远见混合C,CHINA,Mutual Fund,ak
#399011,中海医疗保健主题股票,CHINA,Mutual Fund,ak
#008842,同泰远见混合A,CHINA,Mutual Fund,ak
#003231,创金合信医疗保健股票C,CHINA,Mutual Fund,ak
#002190,农银新能源主题,CHINA,Mutual Fund,ak
#001261,中融新机遇混合,CHINA,Mutual Fund,ak
#003230,创金合信医疗保健股票A,CHINA,Mutual Fund,ak
#320005,诺安价值增长混合,CHINA,Mutual Fund,ak
#010562,永赢成长领航混合A,CHINA,Mutual Fund,ak
#010563,永赢成长领航混合C,CHINA,Mutual Fund,ak
#590008,中邮战略新兴产业混合,CHINA,Mutual Fund,ak
#001861,富安达健康人生混合,CHINA,Mutual Fund,ak
#003145,中融竞争优势,CHINA,Mutual Fund,ak
#001606,农银工业4.0混合,CHINA,Mutual Fund,ak
#000684,长盛养老健康产业灵活配置混合,CHINA,Mutual Fund,ak
#671030,西部利得事件驱动股票,CHINA,Mutual Fund,ak
#002332,汇丰晋信沪港深A,CHINA,Mutual Fund,ak
#002333,汇丰晋信沪港深C,CHINA,Mutual Fund,ak
#008640,方正富邦科技创新A,CHINA,Mutual Fund,ak
#008641,方正富邦科技创新C,CHINA,Mutual Fund,ak
#003096,中欧医疗健康混合C,CHINA,Mutual Fund,ak
#004332,恒生沪港深新兴产业精选混合,CHINA,Mutual Fund,ak
#160143,南方创业板2年定期开放混合,CHINA,Mutual Fund,ak
#003095,中欧医疗健康混合A,CHINA,Mutual Fund,ak
#004784,招商稳健优选股票,CHINA,Mutual Fund,ak
#110025,易方达资源行业混合,CHINA,Mutual Fund,ak
#630016,华商价值共享混合发起式,CHINA,Mutual Fund,ak
#002300,长盛医疗行业量化配置股票,CHINA,Mutual Fund,ak
#006969,圆信永丰高端制造混合,CHINA,Mutual Fund,ak
#005777,广发科技动力股票,CHINA,Mutual Fund,ak
#005593,上投创新商业模式混合,CHINA,Mutual Fund,ak
#000971,诺安新经济股票,CHINA,Mutual Fund,ak
#002259,鹏华健康环保混合,CHINA,Mutual Fund,ak
#005449,华夏行业龙头混合,CHINA,Mutual Fund,ak
#001220,民生加银研究精选混合,CHINA,Mutual Fund,ak
#006719,国融融盛龙头严选混合C,CHINA,Mutual Fund,ak
#006718,国融融盛龙头严选混合A,CHINA,Mutual Fund,ak
#011143,创金合信新材料新能源股票C,CHINA,Mutual Fund,ak
#010111,广发医药健康混合C,CHINA,Mutual Fund,ak
#000404,易方达新兴成长灵活配置,CHINA,Mutual Fund,ak
#168104,九泰锐丰灵活配置混合(LOF)A,CHINA,Mutual Fund,ak
#168111,九泰锐丰灵活配置混合(LOF)C,CHINA,Mutual Fund,ak
#005351,汇添富行业整合混合,CHINA,Mutual Fund,ak
#009147,建信新能源行业股票,CHINA,Mutual Fund,ak
#001313,上投摩根智慧互联股票,CHINA,Mutual Fund,ak
#009468,博时健康成长双周定期可赎回混合A,CHINA,Mutual Fund,ak
#009469,博时健康成长双周定期可赎回混合C,CHINA,Mutual Fund,ak
#011142,创金合信新材料新能源股票A,CHINA,Mutual Fund,ak
#010110,广发医药健康混合A,CHINA,Mutual Fund,ak
#001558,天弘医疗健康混合A,CHINA,Mutual Fund,ak
#001559,天弘医疗健康混合C,CHINA,Mutual Fund,ak
#006227,华宝科技先锋混合A,CHINA,Mutual Fund,ak
#010842,华宝科技先锋混合C,CHINA,Mutual Fund,ak
#000878,中海医药健康产业精选混合A,CHINA,Mutual Fund,ak
#006909,华夏战略新兴成指ETF联接A,CHINA,Mutual Fund,ak
#006910,华夏战略新兴成指ETF联接C,CHINA,Mutual Fund,ak
#006981,中金新医药股票A,CHINA,Mutual Fund,ak
#007005,中金新医药股票C,CHINA,Mutual Fund,ak
#006366,兴业安保优选混合,CHINA,Mutual Fund,ak
#005642,鹏扬景升A,CHINA,Mutual Fund,ak
#005643,鹏扬景升C,CHINA,Mutual Fund,ak
#000879,中海医药健康产业精选混合C,CHINA,Mutual Fund,ak
#002443,前海开源沪港深龙头精选混合,CHINA,Mutual Fund,ak
#550009,信诚中小盘混合,CHINA,Mutual Fund,ak
#005794,银华心怡灵活配置混合,CHINA,Mutual Fund,ak
#005112,银华中证全指医药卫生,CHINA,Mutual Fund,ak
#009777,中欧阿尔法混合C,CHINA,Mutual Fund,ak
#010586,创金合信医药消费股票C,CHINA,Mutual Fund,ak
#270028,广发制造业精选混合A,CHINA,Mutual Fund,ak
#010023,广发制造业精选混合C,CHINA,Mutual Fund,ak
#050026,博时医疗保健行业混合A,CHINA,Mutual Fund,ak
#005962,宝盈人工智能股票A,CHINA,Mutual Fund,ak
#005352,鹏扬景泰成长混合A,CHINA,Mutual Fund,ak
#005353,鹏扬景泰成长混合C,CHINA,Mutual Fund,ak
#002170,东吴移动互联混合C,CHINA,Mutual Fund,ak
#009776,中欧阿尔法混合A,CHINA,Mutual Fund,ak
#000986,太平灵活配置,CHINA,Mutual Fund,ak
#010585,创金合信医药消费股票A,CHINA,Mutual Fund,ak
#180031,银华中小盘混合,CHINA,Mutual Fund,ak
#040015,华安动态灵活配置混合,CHINA,Mutual Fund,ak
#005963,宝盈人工智能股票C,CHINA,Mutual Fund,ak
#001323,东吴移动互联混合A,CHINA,Mutual Fund,ak
#007875,国融融兴混合A,CHINA,Mutual Fund,ak
#007876,国融融兴混合C,CHINA,Mutual Fund,ak
#000336,农银研究精选混合,CHINA,Mutual Fund,ak
#002408,中信建投医改混合A,CHINA,Mutual Fund,ak
#007553,中信建投医改混合C,CHINA,Mutual Fund,ak
#630015,华商大盘量化精选混合,CHINA,Mutual Fund,ak
#006270,汇安核心成长混合A,CHINA,Mutual Fund,ak
#006271,汇安核心成长混合C,CHINA,Mutual Fund,ak
#001576,国泰智能装备股票A,CHINA,Mutual Fund,ak
#610005,信达澳银红利回报混合,CHINA,Mutual Fund,ak
#001106,华商健康生活混合,CHINA,Mutual Fund,ak
#002780,前海联合泓鑫混合A,CHINA,Mutual Fund,ak
#007043,前海联合泓鑫混合C,CHINA,Mutual Fund,ak
#001222,鹏华外延成长混合,CHINA,Mutual Fund,ak
#008958,嘉实回报精选股票,CHINA,Mutual Fund,ak
#009644,东方阿尔法优势产业混合A,CHINA,Mutual Fund,ak
#009645,东方阿尔法优势产业混合C,CHINA,Mutual Fund,ak
#213003,宝盈策略增长混合,CHINA,Mutual Fund,ak
#001171,工银养老产业股票,CHINA,Mutual Fund,ak
#001476,中银智能制造股票,CHINA,Mutual Fund,ak
#009988,信达澳银蓝筹精选股票,CHINA,Mutual Fund,ak
#005268,鹏华优势企业,CHINA,Mutual Fund,ak
#011322,国泰智能装备股票C,CHINA,Mutual Fund,ak
#006345,景顺长城集英两年定开混合,CHINA,Mutual Fund,ak
#008359,华安医疗创新混合,CHINA,Mutual Fund,ak
#001297,平安智慧中国混合,CHINA,Mutual Fund,ak
#010128,宝盈发展新动能股票A,CHINA,Mutual Fund,ak
#010129,宝盈发展新动能股票C,CHINA,Mutual Fund,ak
#010550,华商双擎领航混合,CHINA,Mutual Fund,ak
#001809,中信建投智信物联网A,CHINA,Mutual Fund,ak
#180012,银华富裕主题混合,CHINA,Mutual Fund,ak
#006002,工银医药健康股票A,CHINA,Mutual Fund,ak
#006132,万家智造优势混合A,CHINA,Mutual Fund,ak
#004812,中欧先进制造股票A,CHINA,Mutual Fund,ak
#004813,中欧先进制造股票C,CHINA,Mutual Fund,ak
#006133,万家智造优势混合C,CHINA,Mutual Fund,ak
#210008,金鹰策略配置混合,CHINA,Mutual Fund,ak
#004636,中信建投智信物联网C,CHINA,Mutual Fund,ak
#009009,平安科技创新混合C,CHINA,Mutual Fund,ak
#006003,工银医药健康股票C,CHINA,Mutual Fund,ak
#007474,华夏创成长ETF联接A,CHINA,Mutual Fund,ak
#007475,华夏创成长ETF联接C,CHINA,Mutual Fund,ak
#006051,鹏扬核心价值灵活配置A,CHINA,Mutual Fund,ak
#006052,鹏扬核心价值灵活配置C,CHINA,Mutual Fund,ak
#009008,平安科技创新混合A,CHINA,Mutual Fund,ak
#005520,国投瑞银创新医疗混合,CHINA,Mutual Fund,ak
#009162,富国医药成长30股票,CHINA,Mutual Fund,ak
#164304,新华中证环保产业指数,CHINA,Mutual Fund,ak
#007151,前海开源沪港深聚瑞混合,CHINA,Mutual Fund,ak
#161725,招商中证白酒指数(LOF),CHINA,Mutual Fund,ak
#000220,富国医疗保健行业混合A,CHINA,Mutual Fund,ak
#011151,富国医疗保健行业混合C,CHINA,Mutual Fund,ak
#004851,广发医疗保健股票A,CHINA,Mutual Fund,ak
#001879,长城创业板指数增强A,CHINA,Mutual Fund,ak
#006928,长城创业板指数增强C,CHINA,Mutual Fund,ak
#004895,华商鑫安灵活混合,CHINA,Mutual Fund,ak
#002861,工银智能制造股票,CHINA,Mutual Fund,ak
#007291,汇丰晋信港股通双核策略混合,CHINA,Mutual Fund,ak
#009057,博时科技创新混合A,CHINA,Mutual Fund,ak
#002387,工银沪港深股票A,CHINA,Mutual Fund,ak
#007512,工银沪港深股票C,CHINA,Mutual Fund,ak
#009163,广发医疗保健股票C,CHINA,Mutual Fund,ak
#257070,国联安优选行业混合,CHINA,Mutual Fund,ak
#004148,圆信永丰多策略,CHINA,Mutual Fund,ak
#009058,博时科技创新混合C,CHINA,Mutual Fund,ak
#000965,汇丰晋信新动力混合,CHINA,Mutual Fund,ak
#009491,宝盈创新驱动股票A,CHINA,Mutual Fund,ak
#011453,华泰柏瑞医疗健康C,CHINA,Mutual Fund,ak
#001702,东方创新科技混合,CHINA,Mutual Fund,ak
#001344,易方达沪深300医药联接A,CHINA,Mutual Fund,ak
#007883,易方达沪深300医药联接C,CHINA,Mutual Fund,ak
#001534,华宝万物互联混合,CHINA,Mutual Fund,ak
#009312,前海联合价值优选混合A,CHINA,Mutual Fund,ak
#009313,前海联合价值优选混合C,CHINA,Mutual Fund,ak
#009361,招商创新增长混合C,CHINA,Mutual Fund,ak
#009492,宝盈创新驱动股票C,CHINA,Mutual Fund,ak
#004424,汇添富文体娱乐混合,CHINA,Mutual Fund,ak
#005805,华泰柏瑞医疗健康A,CHINA,Mutual Fund,ak
#000126,招商安润混合,CHINA,Mutual Fund,ak
#519110,浦银安盛价值成长混合A,CHINA,Mutual Fund,ak
#009360,招商创新增长混合A,CHINA,Mutual Fund,ak
#001676,江信同福C,CHINA,Mutual Fund,ak
#213002,宝盈泛沿海增长混合,CHINA,Mutual Fund,ak
#163411,兴全精选混合,CHINA,Mutual Fund,ak
#001703,银华沪港深增长股票,CHINA,Mutual Fund,ak
#006408,汇添富消费升级混合,CHINA,Mutual Fund,ak
#161837,银华大盘两年定开混合,CHINA,Mutual Fund,ak
#001675,江信同福A,CHINA,Mutual Fund,ak
#377150,上投摩根健康品质生活混合,CHINA,Mutual Fund,ak
#001956,国联安科技动力,CHINA,Mutual Fund,ak
#001230,鹏华医药科技,CHINA,Mutual Fund,ak
#519935,长信创新驱动股票,CHINA,Mutual Fund,ak
#005634,汇安行业龙头混合,CHINA,Mutual Fund,ak
#009566,汇安泓阳三年持有期混合,CHINA,Mutual Fund,ak
#519120,浦银安盛新兴产业混合,CHINA,Mutual Fund,ak
#005342,长安裕泰混合C,CHINA,Mutual Fund,ak
#002482,宝盈互联网沪港深混合,CHINA,Mutual Fund,ak
#005341,长安裕泰混合A,CHINA,Mutual Fund,ak
#005742,南方成安优选混合,CHINA,Mutual Fund,ak
#160634,鹏华中证环保产业指数(LOF),CHINA,Mutual Fund,ak
#519113,浦银安盛精致生活混合,CHINA,Mutual Fund,ak
#001951,金鹰改革红利混合,CHINA,Mutual Fund,ak
#008264,南方ESG股票A,CHINA,Mutual Fund,ak
#008063,汇添富大盘核心资产混合,CHINA,Mutual Fund,ak
#001396,建信互联网+产业升级股票,CHINA,Mutual Fund,ak
#008919,永赢科技驱动A,CHINA,Mutual Fund,ak
#008920,永赢科技驱动C,CHINA,Mutual Fund,ak
#163114,申万菱信中证环保产业指数(LOF)A,CHINA,Mutual Fund,ak
#001135,益民品质升级混合,CHINA,Mutual Fund,ak
#010419,申万菱信中证环保产业指数(LOF)C,CHINA,Mutual Fund,ak
#005347,诺德量化优选6个月持有期混合,CHINA,Mutual Fund,ak
#005049,长安鑫旺价值混合A,CHINA,Mutual Fund,ak
#008265,南方ESG股票C,CHINA,Mutual Fund,ak
#501311,嘉实港股通新经济指数A,CHINA,Mutual Fund,ak
#006614,嘉实港股通新经济指数C,CHINA,Mutual Fund,ak
#005142,中融沪港深大消费主题A,CHINA,Mutual Fund,ak
#260108,景顺长城新兴成长混合,CHINA,Mutual Fund,ak
#005050,长安鑫旺价值混合C,CHINA,Mutual Fund,ak
#000541,华商创新成长混合发起式,CHINA,Mutual Fund,ak
#180013,银华领先策略混合,CHINA,Mutual Fund,ak
#005237,银华医疗健康量化优选A,CHINA,Mutual Fund,ak
#005671,前海联合研究优选混合A,CHINA,Mutual Fund,ak
#005672,前海联合研究优选混合C,CHINA,Mutual Fund,ak
#002686,中欧丰泓沪港深混合C,CHINA,Mutual Fund,ak
#008681,鹏华价值成长混合,CHINA,Mutual Fund,ak
#005143,中融沪港深大消费主题C,CHINA,Mutual Fund,ak
#001064,广发中证环保ETF联接A,CHINA,Mutual Fund,ak
#002984,广发中证环保ETF联接C,CHINA,Mutual Fund,ak
#006314,中融策略优选混合A,CHINA,Mutual Fund,ak
#006315,中融策略优选混合C,CHINA,Mutual Fund,ak
#005238,银华医疗健康量化优选C,CHINA,Mutual Fund,ak
#090012,大成深证成长40ETF联接,CHINA,Mutual Fund,ak
#008949,平安匠心优选混合A,CHINA,Mutual Fund,ak
#008950,平安匠心优选混合C,CHINA,Mutual Fund,ak
#008412,长盛竞争优势股票A,CHINA,Mutual Fund,ak
#008413,长盛竞争优势股票C,CHINA,Mutual Fund,ak
#002124,广发新兴产业混合A,CHINA,Mutual Fund,ak
#180003,银华-道琼斯88指数A,CHINA,Mutual Fund,ak
#160611,鹏华优质治理混合(LOF),CHINA,Mutual Fund,ak
#009527,浙商汇金新兴消费混合,CHINA,Mutual Fund,ak
#519001,银华价值优选混合,CHINA,Mutual Fund,ak
#000698,宝盈科技30混合,CHINA,Mutual Fund,ak
#000794,宝盈睿丰创新混合A/B,CHINA,Mutual Fund,ak
#005379,添富价值创造定开混合,CHINA,Mutual Fund,ak
#290008,泰信发展主题混合,CHINA,Mutual Fund,ak
#001915,宝盈医疗健康沪港深股票,CHINA,Mutual Fund,ak
#008985,东方红启东三年持有混合,CHINA,Mutual Fund,ak
#004857,广发中证全指建筑材料指数C,CHINA,Mutual Fund,ak
#004856,广发中证全指建筑材料指数A,CHINA,Mutual Fund,ak
#161629,融通中证精准医疗主题指数(LOF),CHINA,Mutual Fund,ak
#009968,金鹰内需成长混合A,CHINA,Mutual Fund,ak
#009969,金鹰内需成长混合C,CHINA,Mutual Fund,ak
#010393,工银健康生活混合A,CHINA,Mutual Fund,ak
#009913,中信保诚成长动力,CHINA,Mutual Fund,ak
#010337,中欧悦享生活混合C,CHINA,Mutual Fund,ak
#009502,国寿安保创新医药股票A,CHINA,Mutual Fund,ak
#162605,景顺长城鼎益混合(LOF),CHINA,Mutual Fund,ak
#001048,富国新兴产业股票,CHINA,Mutual Fund,ak
#002685,中欧丰泓沪港深混合A,CHINA,Mutual Fund,ak
#009548,汇添富中盘价值精选混合A,CHINA,Mutual Fund,ak
#009549,汇添富中盘价值精选混合C,CHINA,Mutual Fund,ak
#009893,大摩优悦安和混合,CHINA,Mutual Fund,ak
#001118,华宝事件驱动混合,CHINA,Mutual Fund,ak
#010394,工银健康生活混合C,CHINA,Mutual Fund,ak
#010336,中欧悦享生活混合A,CHINA,Mutual Fund,ak
#009503,国寿安保创新医药股票C,CHINA,Mutual Fund,ak
#010433,广发新兴产业混合C,CHINA,Mutual Fund,ak
#540010,汇丰晋信科技先锋股票,CHINA,Mutual Fund,ak
#000780,鹏华医疗保健股票,CHINA,Mutual Fund,ak
#002152,华宝核心优势混合,CHINA,Mutual Fund,ak
#002669,华商万众创新混合,CHINA,Mutual Fund,ak
#009661,平安研究睿选混合A,CHINA,Mutual Fund,ak
#009662,平安研究睿选混合C,CHINA,Mutual Fund,ak
#001088,华宝国策导向混合,CHINA,Mutual Fund,ak
#050010,博时特许价值混合A,CHINA,Mutual Fund,ak
#000609,华商新量化混合,CHINA,Mutual Fund,ak
#000796,宝盈睿丰创新混合C,CHINA,Mutual Fund,ak
#009539,兴业睿进混合A,CHINA,Mutual Fund,ak
#050009,博时新兴成长混合,CHINA,Mutual Fund,ak
#160422,华安创业板50ETF联接A,CHINA,Mutual Fund,ak
#160424,华安创业板50ETF联接C,CHINA,Mutual Fund,ak
#007084,天治转型升级混合,CHINA,Mutual Fund,ak
#169102,东方红睿阳三年混合,CHINA,Mutual Fund,ak
#007412,景顺长城绩优成长混合,CHINA,Mutual Fund,ak
#007465,交银创业板50指数C,CHINA,Mutual Fund,ak
#002472,光大先进服务业混合,CHINA,Mutual Fund,ak
#009540,兴业睿进混合C,CHINA,Mutual Fund,ak
#005453,前海开源医疗健康A,CHINA,Mutual Fund,ak
#005454,前海开源医疗健康C,CHINA,Mutual Fund,ak
#007082,平安高端制造混合A,CHINA,Mutual Fund,ak
#007083,平安高端制造混合C,CHINA,Mutual Fund,ak
#007464,交银创业板50指数A,CHINA,Mutual Fund,ak
#161812,银华深证100指数(LOF),CHINA,Mutual Fund,ak
#160420,华安创业板50指数,CHINA,Mutual Fund,ak
#398011,中海分红增利混合,CHINA,Mutual Fund,ak
#006265,红土创新新科技股票,CHINA,Mutual Fund,ak
#004091,博时沪港深价值优选A,CHINA,Mutual Fund,ak
#001143,华商量化进取混合,CHINA,Mutual Fund,ak
#009878,平安低碳经济混合A,CHINA,Mutual Fund,ak
#009879,平安低碳经济混合C,CHINA,Mutual Fund,ak
#009665,汇添富医疗积极成长一年持有混合C,CHINA,Mutual Fund,ak
#011102,天弘中证光伏产业指数A,CHINA,Mutual Fund,ak
#011103,天弘中证光伏产业指数C,CHINA,Mutual Fund,ak
#260104,景顺长城内需增长混合,CHINA,Mutual Fund,ak
#003291,信达澳银健康中国混合,CHINA,Mutual Fund,ak
#002450,平安睿享文娱混合A,CHINA,Mutual Fund,ak
#002451,平安睿享文娱混合C,CHINA,Mutual Fund,ak
#001385,东方新思路混合C,CHINA,Mutual Fund,ak
#008286,易方达研究精选股票,CHINA,Mutual Fund,ak
#007737,诺德研发创新100,CHINA,Mutual Fund,ak
#004092,博时沪港深价值优选C,CHINA,Mutual Fund,ak
#009664,汇添富医疗积极成长一年持有混合A,CHINA,Mutual Fund,ak
